{
  "schema_version": 1,
  "id": "contra",
  "name": "Contra",
  "official_url": "https://contra.com/",
  "domain": "services",
  "roles": [],
  "status": "queued",
  "created_at": "2026-10-23",
  "color": {
    "hex": "#94654D",
    "oklch": {
      "l": 0.55,
      "c": 0.07,
      "h": 48
    }
  },
  "evidence": [],
  "claims": [],
  "observations": [],
  "opportunities": [],
  "risks": [],
  "experiments": []
}
