{
  "schema_version": 1,
  "id": "ream",
  "name": "Ream",
  "official_url": "https://reamstories.com/",
  "domain": "literature",
  "roles": [],
  "status": "queued",
  "created_at": "2026-10-23",
  "color": {
    "hex": "#86CDFF",
    "oklch": {
      "l": 0.82,
      "c": 0.1,
      "h": 240
    }
  },
  "evidence": [],
  "claims": [],
  "observations": [],
  "opportunities": [],
  "risks": [],
  "experiments": []
}
