{
  "schema_version": 1,
  "id": "fiverr",
  "name": "Fiverr",
  "official_url": "https://www.fiverr.com/",
  "domain": "services",
  "roles": [],
  "status": "queued",
  "created_at": "2026-10-23",
  "color": {
    "hex": "#AC9E2B",
    "oklch": {
      "l": 0.69,
      "c": 0.13,
      "h": 102
    }
  },
  "evidence": [],
  "claims": [],
  "observations": [],
  "opportunities": [],
  "risks": [],
  "experiments": []
}
