{
  "schema_version": 1,
  "id": "github-sponsors",
  "name": "GitHub Sponsors",
  "official_url": "https://github.com/sponsors",
  "domain": "subscriptions",
  "roles": [],
  "status": "queued",
  "created_at": "2026-10-23",
  "color": {
    "hex": "#8E2698",
    "oklch": {
      "l": 0.48,
      "c": 0.19,
      "h": 324
    }
  },
  "evidence": [],
  "claims": [],
  "observations": [],
  "opportunities": [],
  "risks": [],
  "experiments": []
}
