{
  "schema_version": 1,
  "id": "upwork",
  "name": "Upwork",
  "official_url": "https://www.upwork.com/",
  "domain": "services",
  "roles": [],
  "status": "queued",
  "created_at": "2026-10-23",
  "color": {
    "hex": "#E7BA97",
    "oklch": {
      "l": 0.82,
      "c": 0.07,
      "h": 60
    }
  },
  "evidence": [],
  "claims": [],
  "observations": [],
  "opportunities": [],
  "risks": [],
  "experiments": []
}
